time,user_name,user_color,message,is_meaningful
16265,streamelements,#5B99FF,"Cerber is on TikTok, Twitter, YouTube, Instagram, and Discord! â™¥ Go see all the silly stuff!! (â‰§âˆ‡â‰¦*) https://cerbervt.carrd.co/",True
16268,roguekh,,Goodnight Cerber and Minawan. See you tomorrow for the hopefully Cerbathon finale,True
16287,patrock99,,What's the name of the song before trampoline? cerbyLove,True
16291,naomi37,#FF69B4,I got excited :D that was the song i was trying to request so fun,True
16334,cabbagewan,#FF0000,@cinartic Cerber is usually taking requests. Feel free to ask. :),True
16456,hthehumanbeing,,cerbyBounce cerbyRave2 cerbyRave1 cerbyRave2 cerbyBounce cerbyRave1 cerbyRave2 cerbyBounce cerbyRave1,True
16474,hthehumanbeing,,cerbyHype cerbyHype cerbyHype cerbyBounce cerbyBounce cerbyBounce,True
16512,hthehumanbeing,,cerbyMinaJam cerbyMinaBounce cerbyMinaJam cerbyMinaBounce cerbyMinaJam cerbyMinaBounce,True
16631,redeyesdarkknight07,#FF0000,cerbyRave2 rubeeCheer minaaoCheer cerbyRave2 rubeeCheer minaaoCheer cerbyRave2 rubeeCheer minaaoCheer,True
16655,harbingerwan,#1E90FF,"Man, that song really reminds me of Cerbathon 1 cerbyCozy",True
16671,tiny_ghost_haunting_u,#9ACD32,stay at ur house was first song i requested from cerber when i started watching ; w ;,True
16738,vi_of_sloth,#8A2BE2,Recently i reheard girl A and it sounds different to how i remember and i cant tell why,True
16967,gamershower_taken,#FF69B4,It has occurred to me I have not heard you sing BOOM...,True
16996,puggooooooooo,#FF69B4,cerbyBounce cerbyMinaJam cerbyBounce cerbyMinaBounce cerbyBounce,True
17005,teafee_,#00FF7F,cerbyMinaDoko cerbyMinaExcited cerbyMinaBounce cerbyMinaJam,True
17125,hthehumanbeing,,cerbyBounce cerbyMinaBounce cerbyMinaJam cerbyBounce cerbyMinaBounce cerbyMinaJam cerbyBounce cerbyMinaBounce cerbyMinaJam,True
17130,tyskstefan,#0000FF,"ello Cerber & everyone cerbyCozy apriPet I'm late, but I made it. hope day is good cerbyCozy",True
17135,puggooooooooo,#FF69B4,cerbyHype cerbyRave2 spongeyRave minibotGroove creHype vedalCheer vedalEvilCheer laynaRave psyder1Rave1 shoomVibe mewmoteCheer ironmouseLETSGOHYPE,True
17137,streamelements,#5B99FF,cerbyDinkDonk Cerbathon timer values: T1 = 10 seconds; T2 = 20 seconds; T3 = 50 seconds; 10 seconds/500 bits cerbyRave2 You can find the goals here: https://x.com/cerberVT/status/1933915414754722046 cerbyPoint,True
17163,hthehumanbeing,,cerbyRave1 cerbyRave2 cerbyRave1 cerbyRave2 cerbyRave1 cerbyRave2,True
17165,krysanthema,#662E6A,I came back at the right time cerbyRave2 cerbySoCute cerbyRave2 cerbySoCute cerbyRave2 cerbySoCute,True
17177,graded_s,#00FF7F,tacopr2Teehee  Tacowan sends love raid tacopr2Teehee  Tacowan sends love raid tacopr2Teehee  Tacowan sends love raid,True
17178,sirarlis,#000000,tacopr2Teehee  Tacowan sends love raid tacopr2Teehee  Tacowan sends love raid tacopr2Teehee  Tacowan sends love raid,True
17183,ace_in_exile_231,#FF0000,tacopr2Teehee Tacowan sends love raid tacopr2Teehee Tacowan sends love raid tacopr2Teehee Tacowan sends love raid,True
17183,streamelements,#5B99FF,Go check out lovely @TacoPrincessArts! Lately they've been playing PEAK. Find them here~ https://twitch.tv/tacoprincessarts â™¥,True
17185,tacoprincessarts,#FF69B4,tacopr2Teehee  Tacowan sends love raid tacopr2Teehee  Tacowan sends love raid tacopr2Teehee  Tacowan sends love raid,True
17186,graded_s,#00FF7F,tacopr2Teehee  Tacowan sends love raid tacopr2Teehee  Tacowan sends love raid tacopr2Teehee  Tacowan sends love raid cerbyLove,True
17190,mr_mcpippens,#8A2BE2,cerbyHeart I'm just thinking of when you did the dance in VR to that song,True
17198,streamelements,#5B99FF,Go check out lovely TacoPrincessArts! Lately they've been playing PEAK. Find them here~ https://twitch.tv/tacoprincessarts â™¥,True
17208,graded_s,#00FF7F,tacopr2Teehee  Tacowan sends love raid tacopr2Teehee  Tacowan sends love raid tacopr2Teehee  Tacowan sends love raid,True
17273,aaw_doctor_snake,#FF4500,cerbyRave2 cerbyMinaJam cerbyRave2 cerbyMinaJam cerbyRave2,True
17313,mizumivt,#8A2BE2,cerbyRave2 cerbyMinaJam cerbyRave2 cerbyMinaJam cerbyRave2,True
17324,hthehumanbeing,,cerbyHype cerbyRave1 cerbyRave2 cerbyHype cerbyRave1 cerbyRave2 cerbyHype cerbyRave1 cerbyRave2 cerbyGremlin,True
17465,streamelements,#5B99FF,"Cerber is on TikTok, Twitter, YouTube, Instagram, and Discord! â™¥ Go follow or she might bÌ¶iÌ¶tÌ¶eÌ¶ be sad! Î£(ï½¥å£ï½¥) https://cerbervt.carrd.co/",True
17495,redeyesdarkknight07,#FF0000,cerbyRave1 cerbyMinaJam cerbyRave1 cerbyRave1 cerbyRave1,True
17570,mr_mcpippens,#8A2BE2,@cluelessenby1 she did that one not too long ago cerbyPeek,True
17572,racecarpantsy,#DAA520,finally home cerbyDead hii cerber and minawan cerbyMinaWave,True
17610,harbingerwan,#1E90FF,cerbyMinaJam cerbyRave2 cerbyMinaJam cerbyRave2 cerbyMinaJam,True
17707,hthehumanbeing,,cerbyRave2 cerbyGremlin cerbyRave2 cerbyGremlin cerbyRave2 cerbyGremlin,True
17934,redeyesdarkknight07,#FF0000,cerbyRave2 minaaoCheer rubeeCheer cerbyRave2 minaaoCheer rubeeCheer cerbyRave2 minaaoCheer rubeeCheer,True
17948,patrock99,,Cerber. You are absolutely amazing and constantly make me smile. I can listen to you for many hours for and days days and i am. It never gets old. You are special to us cerbyLove,True
17997,doomsailor1,#FF0000,Doomsailor1 gifted a Tier 1 sub to TacoPrincessArts! They have given 157 Gift Subs in the channel! ,True
18148,monkeykian206,,"I'm back from my exile and sorry for being a distraction I didn't mean it, will not happen again",True
18169,lephenom,#FF0000,cerbyBounce cerbyMinaDoko cerbyMinaExcited cerbyMinaBounce cerbyMinaJam,True
18210,tiny_ghost_haunting_u,#9ACD32,cerbyRave1 cerbyMinaJam MOGU MOGU cerbyMinaBounce cerbyRave1,True
18212,tiny_ghost_haunting_u,#9ACD32,cerbyRave1 cerbyMinaJam MOGU MOGU cerbyMinaBounce cerbyRave1 cerbyRave1 cerbyMinaJam MOGU MOGU cerbyMinaBounce cerbyRave1,True
18217,vi_of_sloth,#8A2BE2,MOGU MOGU darklo172Shacorave MOGU MOGU  cerbyRave2 MOGU MOGU mewmoteMinyanRave MOGU MOGU nekoellaPetalRave,True
18232,tiny_ghost_haunting_u,#9ACD32,cerbyRave1 cerbyMinaJam MOGU MOGU cerbyMinaBounce cerbyRave1,True
18250,tiny_ghost_haunting_u,#9ACD32,cerbyMinaJam cerbySpin cerbyBounce cerbyZoomies cerbyMinaExcited cerbySoCute cerbyMinaGun,True
18270,vi_of_sloth,#8A2BE2,MOGU MOGU darklo172Shacorave MOGU MOGU  cerbyRave2 MOGU MOGU mewmoteMinyanRave MOGU MOGU nekoellaPetalRave,True
18270,tiny_ghost_haunting_u,#9ACD32,cerbyRave1 cerbyMinaJam MOGU MOGU cerbyMinaBounce cerbyRave1,True
18289,vi_of_sloth,#8A2BE2,MOGU MOGU darklo172Shacorave MOGU MOGU  cerbyRave2 MOGU MOGU mewmoteMinyanRave MOGU MOGU nekoellaPetalRave,True
18289,tiny_ghost_haunting_u,#9ACD32,cerbyRave1 cerbyMinaJam MOGU MOGU cerbyMinaBounce cerbyRave1 cerbyRave1 cerbyMinaJam MOGU MOGU cerbyMinaBounce cerbyRave1,True
18292,tiny_ghost_haunting_u,#9ACD32,cerbyRave1 cerbyMinaJam MOGU MOGU cerbyMinaBounce cerbyRave1,True
18295,tiny_ghost_haunting_u,#9ACD32,cerbyRave1 cerbyMinaJam MOGU MOGU cerbyMinaBounce cerbyRave1 cerbyRave1 cerbyMinaJam MOGU MOGU cerbyMinaBounce cerbyRave1,True
18311,tiny_ghost_haunting_u,#9ACD32,cerbyRave1 cerbyMinaJam MOGU MOGU cerbyMinaBounce cerbyRave1,True
18312,mr_mcpippens,#8A2BE2,Mr_McPippens gifted a Tier 1 sub to OneFallingLeaf_! They have given 1703 Gift Subs in the channel! ,True
18348,vi_of_sloth,#8A2BE2,MOGU MOGU darklo172Shacorave MOGU MOGU  cerbyRave2 MOGU MOGU mewmoteMinyanRave MOGU MOGU nekoellaPetalRave,True
18352,tiny_ghost_haunting_u,#9ACD32,cerbyRave1 cerbyMinaJam MOGU MOGU cerbyMinaBounce cerbyRave1 cerbyRave1 cerbyMinaJam MOGU MOGU cerbyMinaBounce cerbyRave1,True
18363,flamingmagmafish,,cerbyRave2 MOGU MOGU cerbyRave2 cerbyRave2 MOGU MOGU cerbyRave2 v,True
18369,tiny_ghost_haunting_u,#9ACD32,cerbyRave1 cerbyMinaJam MOGU MOGU cerbyMinaBounce cerbyRave1 cerbyRave1 cerbyMinaJam MOGU MOGU cerbyMinaBounce cerbyRave1,True
18372,vi_of_sloth,#8A2BE2,MOGU MOGU darklo172Shacorave MOGU MOGU  cerbyRave2 MOGU MOGU mewmoteMinyanRave MOGU MOGU nekoellaPetalRave,True
18391,tiny_ghost_haunting_u,#9ACD32,cerbyRave1 cerbyMinaJam MOGU MOGU cerbyMinaBounce cerbyRave1,True
18393,vortexcat99,#1E90FF,cerbyRave2 cerbyRave2 cerbyCozy MOGU MOGU cerbyCozy cerbyRave2 cerbyRave2,True
18395,synderwan,#FF4500,Synderwan gifted a Tier 1 sub to mogumogu! They have given 361 Gift Subs in the channel! ,True
18412,kyasulfwan,#8A2BE2,cerbyRave2 MOGU MOGU cerbyRave2 vcerbyRave2 MOGU MOGU cerbyRave2,True
18413,hthehumanbeing,,cerbyRave1 MOGU MOGU cerbyRave1cerbyRave1 MOGU MOGU cerbyRave1,True
18415,plasmolewan,#8A2BE2,MOGU MOGU GriddyGoose cerbyGremlin MOGU MOGU MOGU MOGU MOGU,True
18421,mr_mcpippens,#8A2BE2,Mr_McPippens gifted a Tier 1 sub to rborbinha! They have given 1704 Gift Subs in the channel! ,True
18430,tiny_ghost_haunting_u,#9ACD32,cerbyRave1 cerbyMinaJam MOGU MOGU cerbyMinaBounce cerbyRave1  YUMMY!!!! cerbySpin cerbyBounce,True
18432,tiny_ghost_haunting_u,#9ACD32,cerbyRave1 cerbyMinaJam MOGU MOGU cerbyMinaBounce cerbyRave1  YUMMY!!!! cerbySpin cerbyBounce cerbyRave1 cerbyMinaJam MOGU MOGU cerbyMinaBounce cerbyRave1  YUMMY!!!! cerbySpin cerbyBounce,True
18460,tiny_ghost_haunting_u,#9ACD32,cerbyRave1 cerbyMinaJam MOGU MOGU cerbyMinaBounce cerbyRave1  YUMMY!!!! cerbySpin cerbyBounce,True
18484,tiny_ghost_haunting_u,#9ACD32,cerbyRave1 cerbyMinaJam MOGU MOGU cerbyMinaBounce cerbyRave1  YUMMY!!!! cerbySpin cerbyBounce cerbyRave1 cerbyMinaJam MOGU MOGU cerbyMinaBounce cerbyRave1  YUMMY!!!! cerbySpin cerbyBounce,True
18490,mr_mcpippens,#8A2BE2,had a few gifts in there cerbyPetpet you can ignore mine though,True
18514,mr_mcpippens,#8A2BE2,I was trying to catch mogu-ers that needed a sub cerbyLUL,True
18531,tiny_ghost_haunting_u,#9ACD32,cerbyRave1 cerbyMinaJam MOGU MOGU cerbyMinaBounce cerbyRave1  YUMMY!!!! cerbySpin cerbyBounce,True
18542,diiba_daaba_,#5F9EA0,I really needed some cerber mogu mogu in my day cerbyRave2 MOGU MOGU cerbyRave2 cerbyRave2 MOGU MOGU cerbyRave2,True
18547,patrock99,,Cerber. You are absolutely amazing and constantly make me smile. I can listen to you for many hours for and days days and i am. It never gets old. You are special to us cerbyLove,True
18554,hthehumanbeing,,cerbySoCute cerbyRave1 cerbyRave2 cerbySoCute cerbyRave1 cerbyRave2,True
18564,plasmolewan,#8A2BE2,MOGU MOGU GriddyGoose cerbyGremlin MOGU MOGU MOGU MOGU MOGU,True
18576,tiny_ghost_haunting_u,#9ACD32,cerbyAngy MOGU MOGU cerbyAngy YUMMY cerbyAngy MOGU MOGU YUMMY,True
18628,deletoblue5,#008000,I think half my mogu mogus were stopped by Twitch NOOOO,True
18657,diiba_daaba_,#5F9EA0,@DeletoBlue5 you gotta vary the number of ctrl+V between every mogu mogu message,True
18665,streamelements,#5B99FF,"Cerber is on TikTok, Twitter, YouTube, Instagram, and Discord! â™¥ Go see all the silly stuff!! (â‰§âˆ‡â‰¦*) https://cerbervt.carrd.co/",True
18688,deletoblue5,#008000,@diiba_daaba_ have to optimize my strategy for maximum mogu output mhm,True
18860,themarleyshow2016,#DAA520,"My name is Edwin, I made the Mimic, it was difficult to put the pieces together",True
18964,synderwan,#FF4500,"Minawan are really cool, but have you heard about Cerber!? That's like the best wan ever!",True
18987,patrock99,,Cerber. You are absolutely amazing and constantly make me smile. I can listen to you for many hours for and days days and i am. I can never get enough. You are very special to us cerbyLove,True
18994,skidooqt,#0000FF,minawan are epic. but what about YOU the dawg talking to minawan? so epic.,True
19000,itstobias,#1E90FF,Gabriel ultrakill didn't say Minawan are cute though Cerber.,True
19001,deletoblue5,#008000,counterpoint: Minawan wouldn't be able to go crazy without Cerber,True
19028,patrock99,,Cerber. You are absolutely amazing and constantly make me smile. I can listen to you for many hours for and days days and i am. I can never get enough. You are very special to us cerbyLove,True
19036,tiny_ghost_haunting_u,#9ACD32,cerbyMinaJam cerbyMinaBounce cerbyMinaExcited cerbyMinaDoko,True
19045,mr_mcpippens,#8A2BE2,cerbyHeart I'm really glad I could come home to your amazing singing yet again. I'll love it every time,True
19048,fujiko987,#00FF7F,It's been hours since i said good night.... but i still needed to finish something so i am still here LETSGO,True
19054,kwlkid38,#FF0000,"I'm off to bed now. Goodnight Cerber and Minawan, I'll see you all tomorrow for what will likely be the end of Cerbathon",True
19057,harbingerwan,#1E90FF,"Minawan are great, but gosh dang Cerber never fails to make every day of mine so incredible mhm She's a ray of sunshine who can pierce the most stubborn skies with her radiant self",True
19081,aaw_doctor_snake,#FF4500,Your karaoke is always the best. Nothing else I would rather listen to cerbyCozy,True
19109,harbingerwan,#1E90FF,Gosh dang it I love it when you talk about how happy you are cerbyMinaLove,True
19112,itstobias,#1E90FF,"It's been a very very long day for me, I am going to need to go to sleep now I am afraid, I hope the rest of the stream goes very well, I look forward to tomorrows end of Cerbathon party :D",True
19135,pilli2001,,"time really passes too fast, its already close to the end",True
19165,mr_mcpippens,#8A2BE2,"first I want to apologize for what you're about to read cerbyLUL it's a good thing we will never meet irl, I don't think I could resist pinching your cheeks and just going AAAA",True
19166,cluelessenby1,#FF4500,Oh no what if cerber accidentally bumps timerwan and it adds some numbers,True
19171,merit_uk,#E40F45,"Bedtime for me as well, I think. Can't believe Cerbathon's over again NOOOO",True
19173,plasmolewan,#8A2BE2,"Cheer200 Time for me to head off, my head still hort Sadge. Today was so much fun, thank you minawan / / / Cerber YOU were unbelievable today, so many amazing songs, beautiful performances and man... what a concert YOU put on for us all. The universe and beyond, this puppy is the best and by far the cutest YES minawan should pass it on. Can't wait to see everywan again soon. Thanks for making me feel better for the little time i could spend with you all again",True
19223,mr_mcpippens,#8A2BE2,cerbyHeart I'm always so happy when I get to hear you sing,True
19241,patrock99,,It's so fun to watch you have become an even better singer even just trougout the Cerberthon cerbyYAY,True
19252,harbingerwan,#1E90FF,"Let's play something quick and easy, like Persona 5 mhm",True
19263,mr_mcpippens,#8A2BE2,"there was that game you had to start over on? or Little Nightmares, or hmmMeeting",True
19289,naomi37,#FF69B4,you could finish outer wilds and then you have the DLC hehe,True
19332,gaan22,#D2691E,"as much as i love horros sloppa, im scared if you Dont finish outer wilds we will not see it for weeks, maybe months",True
19349,harbingerwan,#1E90FF,She'll finish Hollowknight and start Silksong aaaaaaany day now KEKW,True
19370,mr_mcpippens,#8A2BE2,"cerbyLUL did you catch my message earlier, started with a little apology",True
19381,lashiba064,#0000FF,i'm more scared of the break making us forget what we were doing in the DLC YES,True
19383,fujiko987,#00FF7F,"Finaly finished, these minecraft leaves LETSGO i can go to sleep^now",True
19412,qorgle,#FF69B4,cerbySmug you thought waiting for silk song to come out was long? now try waiting for cerber to finish hollow knight and start silk song,True
19435,harbingerwan,#1E90FF,"My memory is alright, I can probably remember enough mhm",True
19457,mr_mcpippens,#8A2BE2,if we do DbD can we wake up Putinag and have him solely be the killer? cerbyLUL,True
19473,themarleyshow2016,#DAA520,"Lol Planet Zoo sounds like a Mario galaxy level, is it a level? Its probably not",True
19505,naomi37,#FF69B4,Winding down makes me hope that new pokemon game is good. Im wondering what pokevillagers ill gather,True
19528,zboyph,#2E8B57,Gonna lurk for a bit since im COOKING some sludge cerbySpin,True
19623,harbingerwan,#1E90FF,"I can see it as a way to make it more Rogue-like, but I guess that wasn't really what they wanted",True
19656,backil,#B22222,I propose you find where the code from OW is used so yuo don't forbget before break cerbyPeek,True
19675,scarywolf02,#8A2BE2,Some minagaming at the end sounds like a ton of fun cerbyCozy,True
19708,mr_mcpippens,#8A2BE2,cerbyLUL you make poll-making so confusing sometimes maybe this,True
19710,gaan22,#D2691E,"i feel like (dont know for sure) you almost passed the game, it would be nice to finish it before your break",True
19751,harbingerwan,#1E90FF,She's using all her brain on the spot om Let her work through it,True
19777,mr_mcpippens,#8A2BE2,"cerbyPetpet you just sound so uncertain when you list some of them, it makes me confused whether to add them or not",True
19783,vi_of_sloth,#8A2BE2,Outer wilds was supposed to be horror now SMH im waiting for the fear factor wheyyy,True
19865,streamelements,#5B99FF,"Cerber is on TikTok, Twitter, YouTube, Instagram, and Discord! â™¥ Go follow or she might bÌ¶iÌ¶tÌ¶eÌ¶ be sad! Î£(ï½¥å£ï½¥) https://cerbervt.carrd.co/",True
20001,gaan22,#D2691E,The true horror game is that she will stop singing any second now,True
20039,gaan22,#D2691E,Obsessed night shift? sounds like Cerbathon to me om om om om,True
20130,mr_mcpippens,#8A2BE2,"I trust you to be more brave than kali, if I'm being honest",True
20222,scarywolf02,#8A2BE2,@TsyteTheTerrible I meant to type 91 but I'll just leave it at that om,True
20222,patrock99,,@Mr_McPippens Ill give you want if she's mean and ignores you mhm,True
20309,mr_mcpippens,#8A2BE2,I did want to see if the hug makes it go up or down cerbyLUL but I also really wanted a hug,True
20382,synderwan,#FF4500,"It goes up during hugs, because Cerber only hugs competitively cerbyCool",True
20400,aaw_doctor_snake,#FF4500,Just think about how cute you are and it will go down cerbySmug,True
20400,harbingerwan,#1E90FF,STOP THINKING ABOUT YOUR HEART BEATING FASTER OH NO IT'S GOING FASTER AAAA,True
20432,jimjimjaroo,#00FF7F,At least she's not thinking about breathing.....oh wait Kappa,True
20442,gaan22,#D2691E,"Cerberrrr DoctorSnakeWan, PippensWan And TsyteWan guessed 82",True
20459,harbingerwan,#1E90FF,"Man, this remix of the SM64 File Select is so cozy cerbyCozy",True
20564,harbingerwan,#1E90FF,"Not to worry, it only releases all your banking info YEA",True
20774,mr_mcpippens,#8A2BE2,@tyskStefan :0 Cerber is cute? I have to let everywan know,True
20850,kalinuxyt,#FF0000,"The company lost contact with the lab, they sent you to find out why",True
20871,naomi37,#FF69B4,"labs hired to make thingy, lab stopped answering so your doing in as a contractor to get things like repo",True
20871,harbingerwan,#1E90FF,"The labs work under the umbrella of Attwood and Davis, the lab went dark and now they've hired you to go and get the stuff they were working on mhm",True
20966,harbingerwan,#1E90FF,So essentially they'll help pay for some medical thing and also give you secret AI tech to advance your own stuff mhm,True
21007,gaan22,#D2691E,how much braincell needed to understand this game? i think i do not meet the requirments myself sinuuSip,True
21065,streamelements,#5B99FF,"Cerber is on TikTok, Twitter, YouTube, Instagram, and Discord! â™¥ Go see all the silly stuff!! (â‰§âˆ‡â‰¦*) https://cerbervt.carrd.co/",True
21080,harbingerwan,#1E90FF,"Airlock is a small space separated by 2 doors, essentially to keep the insides in and the outsides out mhm",True
21082,gaan22,#D2691E,Does the AirFryer also have an AirLock instead of  normal door,True
21091,whiskey_metal_guardian,#666FFF,"Good evening Lovely Cerber! Hello Lovely Minawan... Late as heck, but I made it. Sick as a poor dawg, just got home from a 150km trip that took 5 hours... I am beyond exhausted. I'd love to stay but my headache begs to differ. meds, then straight to bed for me...",True
21161,qorgle,#FF69B4,"I often confuse ketchup and women, an easy mistake to make",True
21206,tyskstefan,#0000FF,it's time for me to head to bedge apriBedge SLEEP have fun Cerber & everyone cerbyCozy apriPet,True
21300,wrzlprnft,#9C2542,"Have a great stream everywan, I'll follow the call of my bed cerbyCozy",True
21324,harbingerwan,#1E90FF,"It'll never get old hearing Cerber say lobotomy"" in the cutest way possible cerbyCozy""",True
21409,vulpicula,#00FF7F,alright I think it's finally time for bed... goodnight Minawan cerbyMinaLove vedalBedge,True
21445,harbingerwan,#1E90FF,YES It's a shame they didn't give you a flashlight to look out the porthole om,True
21473,charlesislost,#FF4500,"well, its been fun lurking but seeing as it just hit midnight, i should probably go to sleep... goodnight everywan, make sure to spoil this cutie for me cerbyMinaWave",True
21510,harbingerwan,#1E90FF,D: Cerber! You wouldn't download a car! How could you download a fridge!,True
21606,mr_mcpippens,#8A2BE2,"cerbyPetpet dw about how you're doing"" if you have fun then we will too""",True
21606,kalinuxyt,#FF0000,"Dont take everything at face value, use the percentages, its somewhat detective work",True
21754,itsmeta__,#1E90FF,"ItsMeta__ subscribed at Tier 1. They've subscribed for 5 months! Minawan, if you see this...MAKE THAT TIMER RISE! WE ARE A PACK OF HELLHOUNDS, NOT SLEEPY HOUSE CATS!",True
21774,bbbreezyyy,#398C9F,this is one of those games I want to see from third person,True
21938,mr_mcpippens,#8A2BE2,"we put high tech firmware in the fresh remains of willing participants""""",True
21967,mr_mcpippens,#8A2BE2,"we put high tech firmware in the fresh remains of willing participants"" wheyyy""",True
22021,mr_mcpippens,#8A2BE2,mhm think about it this way; if we put Neuro in Cerber then ... profit ?,True
22171,harbingerwan,#1E90FF,"I mean we got 40% woman and 40% ketchup, we can hazard a guess mhm",True
22211,streamelements,#5B99FF,cerbyDinkDonk Cerbathon timer values: T1 = 10 seconds; T2 = 20 seconds; T3 = 50 seconds; 10 seconds/500 bits cerbyRave2 You can find the goals here: https://x.com/cerberVT/status/1933915414754722046 cerbyPoint,True
22262,harbingerwan,#1E90FF,Why can't all horror games just be at max volume at all time NOOOO,True
22265,streamelements,#5B99FF,"Cerber is on TikTok, Twitter, YouTube, Instagram, and Discord! â™¥ Go follow or she might bÌ¶iÌ¶tÌ¶eÌ¶ be sad! Î£(ï½¥å£ï½¥) https://cerbervt.carrd.co/",True
22351,harbingerwan,#1E90FF,I haven't known what room you were in since we started wheyyy,True
22401,racecarpantsy,#DAA520,i have no idea whats happening but im having fun wheyyy,True
22406,flamingmagmafish,,all I know is that theres a cute dawg on the screen cerbyMILC,True
22439,captaincook965,#1E90FF,"so why is the character like this, are they blind or something?",True
22450,cabbagewan,#FF0000,It's hard to follow along when I'm not the one playing. mhm,True
22453,harbingerwan,#1E90FF,The true horror of this game is using a Cartesian coordinate system AAAA,True
22608,harbingerwan,#1E90FF,"@Gaan22 They are open, the thing is the company gave you Sonar goggles and not a hecking flashlight RAGEY",True
22680,kalinuxyt,#FF0000,This is what you were supposed to use to get used to space navigation (you dont get to keep this ability),True
22782,cabbagewan,#FF0000,mhm Some people also have walkthroughs tattooed onto their arms. It's fair,True
22794,harbingerwan,#1E90FF,Now you just gotta figure out where you are on the map without knowing your location mhm,True
22878,harbingerwan,#1E90FF,"Whatever it was, the goggles were 100% certain about it MONKA",True
22988,scarywolf02,#8A2BE2,"Dang, sucks that you don't have a map anymore. Luckily you're just smart enough to remember it cerbyCozy",True
22988,harbingerwan,#1E90FF,You just willed the map files back onto your headset WICKED,True
23139,harbingerwan,#1E90FF,Through sheer will you prevented the files from being erased mhm,True
23244,qorgle,#FF69B4,"SMH everything else was forgivable, but they went too far",True
23279,wafan,#6C0000,"I can forgive reanimating corpses, maybe even the fowl language, but LEAGUE!",True
23284,harbingerwan,#1E90FF,Maybe just try to minimally use it cerbyLUL Can't help if it bugged,True
23322,jinx_1324768,,JinxLUL FeelsVi AmbessaLove EkkoChest CaitThinking Cinheimer,True
23323,qorgle,#FF69B4,Shrug maybe you had another map you never figured out how to use,True
23327,harbingerwan,#1E90FF,"I'm not sure either, but it's at least a bit helpful for getting stuck on couches ok",True
23362,bigbigbigegg,#8A2BE2,relatively speaking - Iâ€™m sure thereâ€™s great players and people in league but itâ€™s a common meme on,True
23368,harbingerwan,#1E90FF,They get EXTREMELY salty and can be toxic mhm But like any community they're going to have that kind of thing anyways,True
23380,synderwan,#FF4500,"I used to play League.. and yeah, community was something mhm",True
23399,iw3y,#1E90FF,"@Synderwan yeah lol, has cool lore though, other than that it's a lost cause",True
23425,bigbigbigegg,#8A2BE2,Why revive them though if theyâ€™re just gonna play League again om,True
23435,harbingerwan,#1E90FF,"Why didn't they just put AI chips in robots, putting it in bodies seems like an odd leap om",True
23465,streamelements,#5B99FF,"Cerber is on TikTok, Twitter, YouTube, Instagram, and Discord! â™¥ Go see all the silly stuff!! (â‰§âˆ‡â‰¦*) https://cerbervt.carrd.co/",True
23555,harbingerwan,#1E90FF,It's so nice of them to leave some minced beef and ketchup for you right at the entrance cerbyCozy,True
23635,jinx_1324768,,Why have I resorted to watching kpop demon hunters for the 10th time ?,True
23711,fademd,#FF0000,@captaincook965 we gotta go to bendigo to get me cube morty,True
23827,wafan,#6C0000,@lorx_dostuff I don't think you can issue the game a fine,True
23949,harbingerwan,#1E90FF,Also why do they have a smart toilet AINTNOWAY Has a hecking voice assistant,True
23968,validityunderscore,,Nevermind apparently the dizzy thing happened with powder on the last stream,True
23968,wafan,#6C0000,CerbyRoach P CerbyRoach E CerbyRoach E CerbyRoach T CerbyRoach Z CerbyRoach A CerbyRoach,True
