time,user_name,user_color,message,is_meaningful
20074,junn_desu,#DAA520,"didnt get it the first time, still dont get it even now, but appreciate the explanation, thanks princess Cerber",True
20091,backil,#B22222,It's actually just black which with the background of mostly empty space makes it almost invisivle,True
20115,gaan22,#D2691E,Yes i catched up on vod yesterday and stared how you struggle with river for an hour  sinuuSip this time i can cheer you on while you doing it again cerbyWHEYYY,True
20144,backil,#B22222,Kali would be getting timed out so much if he wasn't a minamod om,True
20201,backil,#B22222,@KalinuxYT I mean you're trying to get timed out while being one ICANT,True
20234,kaliastv,#FBAED2,caelan9Bedge hope you have a wonderful time with the game tonight,True
20236,harbingerwan,#1E90FF,You were REALLY tired by the time you were looking for this YES,True
20240,gaan22,#D2691E,"you been so tired, you wnated to stop the boat on middle of rushing river. you dont fight mother nature om",True
20296,pseudonym1k,#9B6BFF,pseudonym1k subscribed at Tier 1. They've subscribed for 10 months! ,True
20350,dozekar_the_cursed,,"bravery isn't not feeling fear, bravery  is still exploring even though it's scurry",True
20357,harbingerwan,#1E90FF,I've seen before but I don't mind at all having you show me again OwO,True
20399,streamelements,#5B99FF,"https://discord.gg/cerberserber Jump in, everywan is welcome!! à«® ãƒ»ï»Œãƒ»áƒ",True
20444,cabbagewan,#FF0000,@HappyBCB There will be more opportunities later when Cerber plays more Marbles,True
20452,harbingerwan,#1E90FF,"Careful, he might bite your head off Hmm He seemed pretty angry",True
20520,l0kiks,#FEAB05,"Good night Cerber, good night minawan. Enjoy the rest of the stream and good luck to everywan on the giveaway cerbyMinaLove",True
20528,rosrwan,#D59BAA,@vituha230 annytfHmm sweet but they taste burnt on the fire,True
20547,gaan22,#D2691E,wait you have RGB and acctually changing colors instead of sticking to only wan and miss the rest of functions? that's crazy,True
20567,harbingerwan,#1E90FF,"You went to this wan first, loop ended, then you went to a different wan for the last loop of the night cause it was closer mhm",True
20619,gaan22,#D2691E,what do you think of this wooden floor? sinuuHmm  it feels... perfect... tooo perfect,True
20681,streamelements,#5B99FF,cerbyDinkDonk Cerbathon timer values: T1 = 10 seconds; T2 = 20 seconds; T3 = 50 seconds; 10 seconds/500 bits cerbyRave2 You can find the goals here: https://x.com/cerberVT/status/1933915414754722046 cerbyPoint,True
20760,harbingerwan,#1E90FF,o7 She's been banned from the cinema for eating all the sludge,True
20836,inconspicuous_semicolon,#E9DE01,inconspicuous_semicolon gifted a Tier 1 sub to orber! They have given 18 Gift Subs in the channel! ,True
20837,mrwaciciel,#1E90FF,Mrwaciciel subscribed with Prime. They've subscribed for 9 months! boopity boopity boop,True
20893,streamelements,#5B99FF,"Cerber is on TikTok, Twitter, YouTube, Instagram, and Discord! â™¥ Go follow or she might bÌ¶iÌ¶tÌ¶eÌ¶ be sad! Î£(ï½¥å£ï½¥) https://cerbervt.carrd.co/",True
20977,inconspicuous_semicolon,#E9DE01,Prayge Flushed (can't wait for the church of orber stream),True
21023,mr_mcpippens,#8A2BE2,cerbyCozy guess we'll just have to wait for the end of the world together,True
21062,talmiior,#FF69B4,"I wish she'd keep the sneezes in, they're always so cute",True
21103,streamelements,#5B99FF,"Mrwacicielwan can no longer bare to look! The powerful, hellish aura of Cerber is much too frightening!",True
21128,zboyph,#2E8B57,i just noticed there is no places to hide so maybe nothing will chase you cerbyWHEYYY,True
21214,thatsoptional,#8A2BE2,ThatsOptional subscribed with Prime. They've subscribed for 16 months! Hi Cerber,True
21246,primetime175,#8E00FF,"PrimeTime175 subscribed at Tier 1. They've subscribed for 9 months, currently on a 9 month streak! Boo. wow, hi Cerber cerbyMinaWave 9 months and so new bone unlocked Let's go cerbyYAY . Setting my sight on the next wan mhm . As always Man I Love Cerber and Man I Love Minawan cerbyMILC cerbyMILM",True
21307,gaan22,#D2691E,o7 i thought dreaming would change the time flow somehow. seems like not,True
21316,mr_mcpippens,#8A2BE2,how chimken  bur[d]er ? my curry is good and spicy cerbyCozy,True
21333,streamelements,#5B99FF,We're giving away a Cerby plush today! cerbyRave2 Enter qualifying marble races throughout the stream and earn points based on your position! Open to anywan who's followed for at least a month cerbyLove,True
21357,hellomistershifty,#FF0057,just constantly have marbles in the corner like subway surfers,True
21365,meek_little_mouse,#8A2BE2,"Learning is half the battle, the other half is violence",True
21406,fattestcatnt,#8A2BE2,"oh wait this is outer wilds. i need to get out of here, dont want to spoil myself. goodnight everyone! cerbyCozy",True
21445,mr_mcpippens,#8A2BE2,"maybe we can have a week where every time a new chatter comes in saying ADHD dawg"" we add a mini game to the stream""",True
21485,baphomerenecrovalis,#FF0000,"Cheer200 Hey cerboingo. I knew this would be the result of my antics. So now that I'm released from my prison, I wanted to bestow these thingamajigs that I've prepared in advance. Don't worry. You'll get much more pleasant gifts than that abomination the future mhm cerbyMILC",True
21546,baphomerenecrovalis,#FF0000,BaphomereNecrovalis is paying forward the Gift they got from cosmicisstardust to the community! ,True
21553,pikatrainer2,#5F9EA0,cerber if you want to hear the song you can check messages-for-cerber but it's not strictly a cerber song so you don't have to share with minawan. you can listen after stream if you prefer,True
21587,jdshort11,#8A2BE2,people tend to not realize the effects streaming usually has on peoples ability to focus/remember etc,True
21623,mr_mcpippens,#8A2BE2,"@jdshort11 mhm it's like what do you mean your struggling to follow 4 conversations while doing 3 things at once""""",True
21669,mr_mcpippens,#8A2BE2,you're also monitoring your model and other aspects of the stream itself,True
21670,pikatrainer2,#5F9EA0,the craziest thing is that this dawg cannot possibly ever be spoiled enough,True
21683,harbingerwan,#1E90FF,"You're also just naturally a pretty energetic dawg, so of course you tend to move fast YES",True
21691,xt421,#8A2BE2,"Honestly, at work, I have started to embody a lot of ADHD"" symptoms despite not having the diagnosis""",True
21692,graynezumiiro,#8A2BE2,Cant believe cerber read this instead of playing the game,True
21751,carbocopr,#5F9EA0,"it's capped, but it has to actually simulate the planets",True
21754,streamelements,#5B99FF,We're giving away a Cerby plush today! cerbyRave2 Enter qualifying marble races throughout the stream and earn points based on your position! Open to anywan who's followed for at least a month cerbyLove,True
21761,jdshort11,#8A2BE2,"its just going as fast as it can, so its limited by how fast your PC can calc all of the things being simulated",True
21769,mhykhol,#FF0000,heard pc is capped to 10x while console is capped at 5x speed,True
21769,pikatrainer2,#5F9EA0,if i fall asleep really fast does that mean i have a really fast computer?,True
21778,xeatak,#9ACD32,Its a pretty technical answer but basically pc can run faster so game time does,True
21781,gaan22,#D2691E,"what is this, gamecube? game speed attached to your FPS ?",True
21794,scaryyc,#1E90FF,it still has to calculate everything that's happening around the solar system,True
21795,mr_mcpippens,#8A2BE2,in doom speedruns they have to cap framerates because certain tricks give you more speed because of it. games are just kind of weird sometimes,True
21801,sjshack,#B22222,the computer has to compute all the movements of the planets and the speed of the pc effects that,True
21802,backil,#B22222,When you go to sleep to pass time game unload all the pretty stuff and only simulates physics so it just does as fast as your machine allows,True
21808,harbingerwan,#1E90FF,"Things happen in the game, right? The planets move, the Sun does sun things, the Twins exchange sand mhm PC has to do all that",True
21810,kezethun,#8A2BE2,That's going to make it really weird to play in 20 years,True
21829,iyammarrok,#9ACD32,oh yeah.... outer wilds is a big ol' physics simulation running at all times. so faster PC can crunch numbers in the background faster.,True
21832,naomi37,#FF69B4,"yeah, at some point things fall into the middle of britle in the base game",True
21836,ludumancer,,it seems like the devs might have forgotten their delta times smh,True
21879,jdshort11,#8A2BE2,yeah its basically a loading screen to the time you want to start at,True
21893,ludumancer,,most games compensate for the difference between actual time and computing time so idk why this one is different,True
21909,carbocopr,#5F9EA0,"sorry, your PC is too slow - now your ship is inside the attlerock",True
21923,baphomerenecrovalis,#FF0000,"Oh speaking of sleep, while I was in the hyperbolic time chamber, I took a nap and had a dream with you in it. You ordered a green tea in a cafe and it had an explosive centipede in it. Maybe avoid ordering that in the future MONKA",True
21928,nuclearwargames,,i think it also has to take into account constantly changing enviroments like brittle hollow and hourglass twin,True
21953,jdshort11,#8A2BE2,"@ludumancer because its skipping time forward, it doesnt need to maintain main loop timing so it just runs as fast as it can",True
21971,cabbagewan,#FF0000,Ewwwww. That's disgusting. Green tea?!? I'll just have my exploding centipede on its own,True
21991,gaan22,#D2691E,"Oh yeah, last night i had dream of watching your karaoke, it was so nice to listen during sleep SLEEP",True
22010,kalinuxyt,#FF0000,Need a cafe where they just do vile stuff to people like throw spiders at them,True
22065,harbingerwan,#1E90FF,What happens when you ask to see the manager of the Karen cafe Hmm,True
22093,streamelements,#5B99FF,"Cerber is on TikTok, Twitter, YouTube, Instagram, and Discord! â™¥ Go see all the silly stuff!! (â‰§âˆ‡â‰¦*) https://cerbervt.carrd.co/",True
22105,vodolle,#1E90FF,the dlc was absolutely terrfiying the first time I saw it,True
22106,graynezumiiro,#8A2BE2,These guys designed a method of instant teleporting but still ended up using rafts CaitThinking,True
22138,harbingerwan,#1E90FF,Well I'll have you know I was looking forward to more Outer Wilds with you cerbyHMPF,True
22140,iyammarrok,#9ACD32,"@ryder9717 outer wilds, not to be confused with outer worlds... it is, hands down, one of the best experiences in gaming... but... if you want to try it, leave stream and go play... you WANT to go in blind.",True
22183,kalinuxyt,#FF0000,Imagine Cerber invites you out to eat but says we're going to Arby's Sadge,True
22201,meek_little_mouse,#8A2BE2,@iyammarrok wish I had amnesia so I could experience this game for the first time again,True
22210,thezakrzi,#00FF7F,TheZakrzi subscribed with Prime. They've subscribed for 6 months! Cerber is cute mhm pass it on,True
22221,baphomerenecrovalis,#FF0000,@KalinuxYT KaliWan i would go to an explosive centipede nest with Cerber if she wanted to cerbyCool,True
22222,harbingerwan,#1E90FF,"As they say, THEY HAVE THE MEATS! No clue what that means though om",True
22229,mr_mcpippens,#8A2BE2,sometimes they have some decent food but it's always seasonal,True
22239,kalinuxyt,#FF0000,@BaphomereNecrovalis Thats where you gotta rescue her from mhm,True
22265,kalinuxyt,#FF0000,Arby's is where I would go if I want to eat questionable meat,True
22276,harbingerwan,#1E90FF,Everything is at least worth trying once mhm Unless you can 100% tell you're not gonna like it,True
22288,mr_mcpippens,#8A2BE2,sometimes you just have to go out and get the questionable meat mhm,True
22291,jdshort11,#8A2BE2,"a good deep fried burger would probably be great, if not double unhealthy",True
22311,mr_mcpippens,#8A2BE2,mhm sometimes I eat an orange to remind myself of why I don't like them,True
22334,harbingerwan,#1E90FF,"Ah but would we have her any other way mhm Nah, she's great as she is",True
22343,mr_mcpippens,#8A2BE2,you've never had an orange but you don't like them? cerbyLUL,True
22353,meek_little_mouse,#8A2BE2,"@CabbageWan That's outback steakhouse, Arby's has the (questionable) meats",True
22354,cludy_,#8A2BE2,I like how oranges taste but I don't really like their texture Sadge,True
22367,mr_mcpippens,#8A2BE2,and wrong? my dawg that's how Orber made them cerbyHMPF,True
22378,jdshort11,#8A2BE2,"theyre a bit of faff to peel and eat, but theyre nice when fresh",True
22383,m4chollo,#008000,if your only eating the outside your doing it wrong btw,True
22384,kalinuxyt,#FF0000,I'm gonna throw an orange at you like a dodgeball so you can bite into its delicious pulp,True
22390,byonic_terror,#FF7F50,I figured you wouldn't be that picky when it came to fruits,True
22415,pikatrainer2,#5F9EA0,i'm gonna take a picture of me eating an orange like an apple and share it in the serber,True
22442,mr_mcpippens,#8A2BE2,"they really ought to upgrade their GPU, this framerate is just silly",True
22494,kalinuxyt,#FF0000,This DLC is really just how to be a professional sleepy head,True
22538,baphomerenecrovalis,#FF0000,"@Byonic_Terror I thought that said Cerber I am petting an orange as we speak"" om""",True
22595,mr_mcpippens,#8A2BE2,cerbyLUL you hate them but they taste good? I also don't like citrus fruits,True
22597,gaan22,#D2691E,WHat do you mean You hate them when you also say they taste good om,True
22603,harbingerwan,#1E90FF,"Typically, using cleaning product on yourself is not good for your skin mhm",True
22612,iyammarrok,#9ACD32,"oh noes.... the citrus based smell they put in things isn't usually citrus... it's citronella, and many have allergies.. so could have been that.",True
22617,baphomerenecrovalis,#FF0000,Cerber?? What the heck are all these puppy stories? First the cupboard and now this?? MONKA,True
22644,ggo_leoknightis,,I had a dream where I choked on an orange and died then I never ate them again,True
22647,mr_mcpippens,#8A2BE2,"like, actual soap? I missed the start and thought you were playing with oranges cerbyLUL",True
22655,gaan22,#D2691E,"but i rememmber i played power wash simulator"" in bathtube",True
22741,baphomerenecrovalis,#FF0000,NOTED Juvenile Cerby's are the most dangerous species of ANYTHING known to man,True
22769,diamondwan,#8A2BE2,ICANT I find it funny that you were freaked out about snapping off the limb of one of the only creatures that would survive such an ordeal (with a living specimen of course),True
22789,harbingerwan,#1E90FF,o7 You were such a brave soul for digging the starfish out of combustible jelly,True
22804,vi_of_sloth,#8A2BE2,@Diamondwan Wouldnt it regrow the leg or am i imagining it?,True
22805,iyammarrok,#9ACD32,rehydrate the starfish that had been put into liquid jelly and then set? hehehe,True
22814,harbingerwan,#1E90FF,You sound like a bit of a troublemaker from these last two KEKW,True
22826,pochipx,#5F9EA0,"Sounds like little Cerber was too adventurous for her own good, but At least we get some good stories.",True
22831,baphomerenecrovalis,#FF0000,@HelloMisterShifty is your name a reference to that one old game about the teleporting assassin guy?,True
22836,byonic_terror,#FF7F50,"I remember having an irrational fear of the jack in the box guy. One night I had to get rid of him because he was evil, so I threw a toy of him i had out the window.",True
22862,hellomistershifty,#FF0057,"@BaphomereNecrovalis good catch but I used this name before that Switch game came out, it was weird when it was released haha",True
22885,talmiior,#FF69B4,"I gotta go, have fun minawan! Don't be too naughty Cerber!",True
22926,kwlkid38,#FF0000,"Cheer100 Cheer100 time for me to head to bed since I have an appointment tomorrow morning to get onto benefits now I'm unemployed. Good luck Minawan with winning the Cerby plushes. Goodnight Cerber, Goodnight Minawan, I'll see you all tomorrow",True
22946,mr_mcpippens,#8A2BE2,childber just kicking old ladies is a development I didn't expect,True
22962,harbingerwan,#1E90FF,"You tell them"" Little Cerber did not interpret that as momma Hellhound intended om""",True
22972,dogbreath_wan,#8A2BE2,"The worst thing I ever did was assault and battery of an elderly woman""""",True
23014,dogbreath_wan,#8A2BE2,All that matters is she learned her lesson about whatever she did YES,True
23018,byonic_terror,#FF7F50,"Cerber, at some point u were a wild child...and u somehow mellowed out",True
23041,iyammarrok,#9ACD32,They do always say that actions speak louder than words. :),True
23048,nuclearwargames,,"Old lady appears, Cerber uses kick, its super affective",True
23062,vi_of_sloth,#8A2BE2,See i thought i hadnt but no now that i think on it i Did,True
23063,wafan,#6C0000,"My brother and I use to fight, but that was about my limit",True
23064,jdshort11,#8A2BE2,who amongst us hasnt wanted to boot someone who cut you off in line,True
23068,junn_desu,#DAA520,"well, children do have violent tendencies, cuz they're children, that's why adults have to control them while young cerbyLUL",True
23074,gaan22,#D2691E,"i had identical situation and i am very sure the lady Seen me, so my impulsive reaction was like that cerbyBlushi",True
23077,mr_mcpippens,#8A2BE2,"I'd fight my brother a lot, and wouldn't do my homework, but that was about it",True
23087,mistahhgrey,#00FFFD,"I cannot comment, no old people tho, I can say that much at least.",True
23109,baphomerenecrovalis,#FF0000,"but you were in detention for talking too much, right:?",True
23116,vi_of_sloth,#8A2BE2,MONKA how many stories are you gonna say thay i have also done? Are these just core british memories PANIC,True
23136,carbocopr,#5F9EA0,my mom was proud when I was told off for talking too much - I was a quiet kid,True
23143,wafan,#6C0000,I got detention for reading all the time. I still just read in detention so...,True
23144,dogbreath_wan,#8A2BE2,Detention! Yay! More opportunity to tell people FNAF lore!,True
23152,baphomerenecrovalis,#FF0000,I want my kami oshi to be God's yappiest yapper. Keep it up cerbyGOODWAN,True
23161,junn_desu,#DAA520,the worse i did in school was flipping the bird at a teacher...,True
23166,harbingerwan,#1E90FF,om The teachers understanding you're a good kid so they just let you nap,True
23169,nuclearwargames,,"how could they put you in detention for yapping, thats one of your bestest strongest features",True
23173,m4chollo,#008000,did you tell your parents your making a livin out of yapping nowadays?,True
23177,iyammarrok,#9ACD32,Rok used to get detention for 'not paying attention' ... but also used to get basically the highest grades.... teachers don't make sense.,True
23184,mistahhgrey,#00FFFD,"I mean, they'd try to get me into some sort of detention"" for all the talking... I did",True
23191,cabbagewan,#FF0000,I imagine you in detention with a hannibal lecter face mask on to stop you from yapping cerbyLUL,True
23201,vi_of_sloth,#8A2BE2,I relate to your tiny bursts of evil as i have also done most if not all the things i have heard om,True
23215,graynezumiiro,#8A2BE2,I threw a walnut at a kid and smacked him right in the forehead with it once,True
23251,harbingerwan,#1E90FF,"You're not a troublemaker, you just didn't have control of your yap cerbyLUL",True
23256,gaan22,#D2691E,"you just fight back when somebody wrongs you, its understandable cerbyPat",True
23267,dogbreath_wan,#8A2BE2,Marbles is actually a vital background process for Windows (lie),True
23293,streamelements,#5B99FF,"Cerber is on TikTok, Twitter, YouTube, Instagram, and Discord! â™¥ Go follow or she might bÌ¶iÌ¶tÌ¶eÌ¶ be sad! Î£(ï½¥å£ï½¥) https://cerbervt.carrd.co/",True
23314,dogbreath_wan,#8A2BE2,Task that disappears from the list when you look at it Susge,True
23326,cabbagewan,#FF0000,mhm Just close everything you don't recognize. I'm sure it will be fine,True
23364,cabbagewan,#FF0000,cerbyMinaBounce As a child I randomly deleted 0kb files from the registry to make the computer run faster.,True
23401,mr_mcpippens,#8A2BE2,"when I was real young I had some sticky fingers, but I didn't take things from stores, just people I knew cerbyLUL",True
23411,truddytank,,I just keep closing things until something breaks or forcefully restarts my pc annytfErmExplode,True
23416,nuzgar,#0000FF,Nuzgar subscribed at Tier 1. They've subscribed for 2 months! Marble time!,True
23435,cabbagewan,#FF0000,@KalinuxYT They were small. Surely they weren't important mhm And I'm sure the computer constantly freezing was unrelated,True
23455,mr_mcpippens,#8A2BE2,"to be fair, the things I took usually didn't have any real value cerbyLUL I just really wanted them",True
23460,vi_of_sloth,#8A2BE2,OK I ACTUALLY STILE FROM MY OLD BEST FRIEND TO ON ACCIDENT om,True
23468,dave_is_me2002,#FF0880,Only thing I ever stole was a pen and a tennis ball cerbyLUL,True
23469,qorgle,#FF69B4,I would bring things home from preschool when I was very young,True
23470,ludumancer,,I stole peopleâ€™s pencils and put them in other peoplesâ€™ backpack :(,True
23484,iw3y,#1E90FF,@KalinuxYT lemme come over so I can look at all your stuff :),True
23486,dogbreath_wan,#8A2BE2,"Thats better than stealing something just to deprive someone else of it. So, bright side?",True
23504,gaan22,#D2691E,"hey can i take your shampoo top cover?"" Cerber it sounds ridicolous",True
23513,kalinuxyt,#FF0000,I also stole from department stores a little as a kid when I saw shiny thing bc I didnt know it was bad,True
23515,cabbagewan,#FF0000,cerbyMinaBounce I was a good child. It wasn't until later i became corrupted.,True
23519,harbingerwan,#1E90FF,"I meant adorable hellhounds cerbyLoad Why did I type Minawan, that's just false",True
23529,mr_mcpippens,#8A2BE2,"as an adult I'd been accused of theft a couple times, but I never did it, they claimed I stole money but I have no reason to do that cerbyLUL",True
23558,cabbagewan,#FF0000,D: That's horrible! How dare she not let you have something!,True
23559,harbingerwan,#1E90FF,I stole a lot from my School's store when I was really little om,True
23606,harbingerwan,#1E90FF,"I was a little thief when I was really young KEKW Thankfully, I learned my ways",True
23620,bigbigbigegg,#8A2BE2,Now watch me win through VR that your head starts spinning cerbySmug,True
23769,iyammarrok,#9ACD32,there's artillery on this one... we're attacking a castle.,True
23862,mistahhgrey,#00FFFD,"Given my lack of luck in general, I'd be surprised if I'm even at the back haha.",True
23884,dogbreath_wan,#8A2BE2,The general leading his men the old fashioned way: Exploding,True
23920,fertap,#FF4500,the poor minawan that got blown off just at the finish line,True
23932,distortionmaster,#0000FF,"I was so close, but I think I got blasted before the finish",True
23933,trollanderror,#8A2BE2,"I was close to the front there for a bit.  Thankfully, I lost just in time",True
23959,synderwan,#FF4500,I was on the leaderboard for a sec before I was annihilated off the world o7 om,True
24041,vi_of_sloth,#8A2BE2,Telling orber to take the wheel seems to be not working great,True
24050,radiostatic832,#008000,"I never believed in boost before, but now Iâ€™m a believer",True
24110,mr_mcpippens,#8A2BE2,if you want my alphabetical list cerbyHMPF I can give it to you when the 3 are over maybe,True
24114,cliop,#1E90FF,Cliop subscribed at Tier 1. They've subscribed for 16 months! I'll consider survival a success WICKED,True
24138,aaw_doctor_snake,#FF4500,I might always be at the bottom but at least I consistently finish,True
24151,distortionmaster,#0000FF,"so far I have not been in top 10, but I have not DNFed HUZZAH",True
24151,baphomerenecrovalis,#FF0000,"Who's on first, what's on second, I dont know is on third",True
24158,mr_mcpippens,#8A2BE2,"I meant if you want it between games I can give it to you alphabetical, but if you want the top 10 in order I'm asking you wait until after the set cerbyLUL",True
24186,ludumancer,,"I must go, my people need me, but have a good stream everyone! a HUZZAH to my fellow losers!",True
24218,mr_mcpippens,#8A2BE2,"cerbyPeek People can still join until the counting in-game finishes btw, so we have to wait for the race to actually begin before we change it back @cerberVT",True
24261,mr_mcpippens,#8A2BE2,"and I was just saying that I can give you the alphabetical list between games, but if you want it ordered I'd prefer not having to do that until after the set mhm",True
24306,vi_of_sloth,#8A2BE2,ORBER jetsDrive TAKE THE WHEEL! I GOT MARBLES TO cerbyMinaGun,True
24310,streamelements,#5B99FF,"What does wan wan"" mean? It's the Japanese sound for ""woof woof""!""",True
24323,streamelements,#5B99FF,We're giving away a Cerby plush today! cerbyRave2 Enter qualifying marble races throughout the stream and earn points based on your position! Open to anywan who's followed for at least a month cerbyLove,True
24407,vi_of_sloth,#8A2BE2,ORBER TRADE OFF YOU cerbyMinaGun  ILL DRIVE nekoellaDrive,True
24434,streamelements,#5B99FF,We're giving away a Cerby plush today! cerbyRave2 Enter qualifying marble races throughout the stream and earn points based on your position! Open to anywan who's followed for at least a month cerbyLove,True
24466,permarin1,#0000FF,"last time i played marbled i won vip for life. was number 1 of 10 maps, and i got first 9/10 runs.. idk how.",True
24466,vi_of_sloth,#8A2BE2,If i didnt take the wheel back i mightve gooten in the 10 nekoellaNOOO my faith was lacking and now orber will cerbyMinaGun me,True
24493,streamelements,#5B99FF,"Cerber is on TikTok, Twitter, YouTube, Instagram, and Discord! â™¥ Go see all the silly stuff!! (â‰§âˆ‡â‰¦*) https://cerbervt.carrd.co/",True
24556,vi_of_sloth,#8A2BE2,Next time i give orber the wheel i shouldnt take it back SMH,True
