time,user_name,user_color,message,is_meaningful
19047,thomie002,#1E90FF,"Cheer200 I want to thank you,most wholesome dog, for this wanderful cerbathon and all the fun, happyness, joy, and so much more.Have the greatest rest of the hours that remain, with lots of spoiling and puddling, a lovely life, and a very relaxing and fulfilling break. I eagerly await when the cutest hellhound returns with her cheer, wholesomeness and most importantly her lovely self again.And most importantly,should you ever feel down, a little nibble of the chocolate horns fixes everything.",True
19048,mr_mcpippens,#8A2BE2,"cerbyLUL I love the clips of you talking over clips,the chaos is incredible",True
19067,itstobias,#1E90FF,Clip Cerber and Real Cerber met each other and the world didnt explode :S,True
19106,racecarpantsy,#DAA520,"Cerber, have i told you that youre super cute today? I HAVENT?! well i never, cant believe myself SMH Cerber, youre super cute and wanderful and amazing and... and... no wan has ever made me this emotional so be proud cerbyHeart",True
19116,harbingerwan,#1E90FF,"You DID say bring a rain poncho, this is what you meant mhm",True
19158,mr_mcpippens,#8A2BE2,"Hmm 5 hours 20 minutes in, and we've gained 10 minutes uhoh",True
19162,hurricate,#008000,@krig147 Danke fÃ¼r das Geschenkabo! pogs pogs pogs Thank you cerbyHeart,True
19183,gaan22,#D2691E,@Mr_McPippens 2:26 but minawan added whole 2 hours during loading screen,True
19185,shin_tsu,#22B3AD,not much progress ending the subathon today cerbyMinaSmug,True
19193,harbingerwan,#1E90FF,"Man, you must really like meeting those idols today Hmm",True
19199,leouji,#5F9EA0,"With Cerbathon coming to an end or indefinitely stuck at 2 hours (please), I just wanted to thank you. You've touched so many lives and continue to do so over the years, you've grown a beautiful community full of some of the most supportive and amazing people I've ever had the pleasure of interacting with. Thank you for everything. from the karaoke to the tears and everything in between, I'm very proud of you and hope you continue to share your warmth with us. continue to shine. Love you.",True
19208,natsunami,#FF69B4,@krig147 Thanks for the gift sub! catPls cerbyGremlin cerbyGremlin cerbyGremlin,True
19212,vi_of_sloth,#8A2BE2,Pepegaphone PEANUT ITS BEEN SO LONG! BURP INTO THE MIC PLEASE ITD BE SO FUNNY AS A GOODBYE MESSAGE,True
19213,crossbow7734,#DAA520,I mean it's the last 2 hours of the Cerbathon no wonder all the meetings happend,True
19258,harbingerwan,#1E90FF,She'll be eating that peezta for the next 4 hours of this 2 hours mhm,True
19311,itstobias,#1E90FF,"that's the rule of dogs, feed them a little bit and then feed them a little bit more then return to step 1",True
19319,kelmster,#5F9EA0,"Just saying, but when stream started, there were 2 hours 26 minutes left. 5 hours and 21 minutes later, there are 2 hours 36 minutes left KEKW",True
19331,harbingerwan,#1E90FF,Can you have a normal stream tomorrow Hmm Doesn't have to be a Cerbathon day,True
19337,bigbigbigegg,#8A2BE2,I dunno how that would work if TimerWan hasn't been depleted yet om,True
19367,racecarpantsy,#DAA520,get timerwan to survive until wednesday night/thursday and i can contribute more,True
19419,gaan22,#D2691E,"imagine we do fnaf thursday and when timerwan ends, Party is over, everybody gets kicked om Spectacular",True
19419,monkeykian206,,You should give timerwan your pizza so we can go foreva,True
19427,iyammarrok,#9ACD32,"Quick, Modwans, inflate it before tomorrow... then the reduce will be negated... mhm mhm",True
19430,racecarpantsy,#DAA520,make it a double power hour so each sub is 2 minutes mhm,True
19442,simchucky,#1E90FF,"Cheer100 Cheer100 I am not so good with words but here goes nothing. / / Cerber, you brought me so much joy throughout this past few months. There were some moments I will never forget like the literal cinema in vienna of course, but also all the spontaneous events like the pool party, all the singing, laughing and dawg puddling. I'm also happy you played wan of my favorite games, Outer Wilds. This cerbathon was really awesome, man I love Cerber and Minawan cerbyMILC",True
19471,naomi37,#FF69B4,18 more days and it would mean we made it last quater of a year,True
19508,exory666,#FF0000,"You streamed for over 3 months straight!! how is that not enough""?! :D""",True
19510,hundred_leaf_orchid,#9ACD32,you could always play The Long Drive until Timerwan runs out. thatâ€™s never gone wrong for anywan. vedalEvilGiggle,True
19526,mr_mcpippens,#8A2BE2,"cerbyBlushi maybe we can keep a goal or two for next year, just for that familiar feeling",True
19529,monkeykian206,,If there are sooo many goals we should add 40 hours for fun please ðŸ¥º,True
19530,harbingerwan,#1E90FF,"You've filled all 71 days full of fun and greatness cerbyCozy It's ok if we didn't do everything, because man we did so much",True
19535,therevival32,#00E7FF,it's better to have too much to do rather than nothing to do sometimes haha,True
19543,hawkstrike15396,#1E90FF,Canâ€™t wait for the last goal *** completed just before Cerbathon 3 classic,True
19555,iyammarrok,#9ACD32,you could try 'my summer car' instead... it's similar to but different from the long drive.,True
19557,bbbreezyyy,#398C9F,71 days and slightly more than 71 streams ReallyInnocent,True
19593,mr_mcpippens,#8A2BE2,at least wait for tomorrow cerbyBlushi or for us to hit that final goal?,True
19618,ggo_leoknightis,,I must say I can offer a perspective on how awesome this Cerbathon has been. Weâ€™ve partied it up and itâ€™s been so much fun. I know Iâ€™ve been in a call with Minawan for 32 days now and it has been so much fun. From singing to ranking every Crayon Flavor itâ€™s been so good. Getting to hang out here aswell just driving it into wan of the best times Iâ€™ve ever had at a streamer,True
19625,qorgle,#FF69B4,cerbySmug I'm noticing the timer going up instead of down again,True
19627,itstobias,#1E90FF,"Timerwan gets reduced to +1 second when the subs goal 66,666 is reached?",True
19644,chillgooseyy,#FF4500,I started watching while cerbathon was going on when it ends the schedule for streams is going to be so weird cerbyDead,True
19678,ggo_leoknightis,,@Hi_XP hiii XP wan! STARE weâ€™ll be departed from each other soon cerbyCry,True
19680,merit_uk,#E40F45,"Right, I have to go to bed. Have a wonderful end to the Cerbathon cerbyMinaWave  I'm sure it won't be still going when I wake up",True
19683,gaan22,#D2691E,"Lets watch one piece, stream ends when timerwan reach zero",True
19685,itstobias,#1E90FF,I dont know what I am going to do with my life when Cerbathon ends,True
19686,mr_mcpippens,#8A2BE2,marbles would be pretty fun cerbyHeart we didn't get to do too many non-qualifying,True
19727,renegade_v,#FF0000,"@iyammarrok i only watched the main SAO, never the abridged",True
19741,ggo_leoknightis,,I can post the tier list in Cerber General if you want @cerbervt cerbyLove,True
19745,streamelements,#5B99FF,"Blacknikswan can no longer bare to look! The powerful, hellish aura of Cerber is much too frightening!",True
19748,streamelements,#5B99FF,"Cerber is on TikTok, Twitter, YouTube, Instagram, and Discord! â™¥ Go follow or she might bÌ¶iÌ¶tÌ¶eÌ¶ be sad! Î£(ï½¥å£ï½¥) https://cerbervt.carrd.co/",True
19797,neilos_79,,"Nooo, i had to leave and be awake at 5am. I'll miss the love. Everyone, have a good night, morning; Cer.  All my love, take care, and feel the love you deserve!",True
19810,hellomistershifty,#FF0057,wan we hit the goal the 24 hour stream starts now right? ðŸ‘‰ðŸ‘ˆ,True
19837,harbingerwan,#1E90FF,Your marble is going to be default and YOU'RE GOING TO LIKE IT RAGEY,True
19842,gaan22,#D2691E,"set to special events, cerbathon end, totally not clickBait xdx",True
19854,mr_mcpippens,#8A2BE2,I want a fancy marble cerbyBlushi but they don't have any Cerber themed,True
19866,znakerfin,#82CAFF,@vortexcat99 There will be instructions in the game when we can join,True
19891,bbbreezyyy,#398C9F,"they dont care about us, they just want number go up SMH",True
19930,reminuszero,#FF7F50,"Still almost 3 hrs left almost 6 hrs later, we might make it to Cerberthon day 73",True
19932,derflo1234,#1E90FF,@HelloMisterShifty without any preparation? It will probably an event when the weekly scheduled streams return,True
19932,xonortlemagnifique,#9ACD32,They don't care about Minawan??? They must be ... losing their marbles,True
19933,znakerfin,#82CAFF,Those who play a lot can have like 4 to 6 streams they play at the same time,True
19936,harbingerwan,#1E90FF,"I wish I knew how to boost, but all I know is sludge NOOOO",True
19946,deletoblue5,#008000,you gotta use your commands with strategic expertise mhm,True
19946,racecarpantsy,#DAA520,i was born for racing cerbyCool (i've never won or placed well in a race om ),True
19955,streamelements,#5B99FF,"cherriblysswan can no longer bare to look! The powerful, hellish aura of Cerber is much too frightening!",True
19958,wrzlprnft,#9C2542,Minawan haven't lost all their marbles after all haselNODDERS,True
19971,vaughnsteam,#8A2BE2,One time I wondered into their stream. And they gifted me a marble,True
19981,xonortlemagnifique,#9ACD32,For Marble addiction therapy reach out at your local marble center.,True
20007,hundred_leaf_orchid,#9ACD32,@wrzlprnft many of us donâ€™t have any marbles to begin with. cerbyGOODWAN,True
20011,scottdj057,#00FF7F,"I only want one thing, and that is to make everyone happy cerbyMinaBlush",True
20022,carbocopr,#5F9EA0,"Prayge Flushed Dear Orber, please have compassion on our dear starving timer-wan.  Cheer500",True
20052,beeeeeeeest,#7995CB,"goodbye minawan, goodbye lovely cerber. i sadly will have to go to sleep now because of business travel Sadge i really enjoyed my time at the cerberthon and hope you end the thon with a bang.",True
20063,xaleheart,#5F9EA0,"I offer a truce, for the near future no more spreading of the true-true. Cheer200",True
20085,pikatrainer2,#5F9EA0,I just want to help cerber sometimes feel a little more confident because I think cerber is amazing,True
20088,qorgle,#FF69B4,you can pick 2 minawan to compete against each other and whichever come higher wins,True
20090,harbingerwan,#1E90FF,The word is in automod so they can't say what they wanted to KEKW,True
20114,bovokk,#8A2BE2,I bet 100 puppy points that a marble will win the next race.,True
20115,vaughnsteam,#8A2BE2,"I made it to work, and I'm secretly watching the dog on my phone",True
20125,itstobias,#1E90FF,Gamba on the racer with a name starting with A-M or L-Z,True
20206,qorgle,#FF69B4,GAMBA on how many restarts to get marbles on stream mhm,True
20239,distortionmaster,#0000FF,"Cerber, the Marbles can't always be on stream, they need to rest too",True
20240,backil,#B22222,Can't we GAMBA on how many minawan will make it to finish?,True
20280,racecarpantsy,#DAA520,kind of a bop but we got spoiled with Marbles on Stream,True
20307,carbocopr,#5F9EA0,@Derflo1234 Prayge Flushed It shows our devotion to Orber (nothing),True
20310,cabbagewan,#FF0000,"(Minawan, that's not how you spell carnage. Don't learn spelling from Marbles on stream songs)",True
20311,mr_mcpippens,#8A2BE2,"you say you don't know what I mean when I say you're the best, who else would restart the game 3 times for a silly song cerbySoCute Cheer500",True
20343,puggooooooooo,#FF69B4,cerbyMinaJam cerbyRave2 cerbyMinaJam cerbyBounce cerbyMinaJam cerbyRave2 cerbyMinaJam,True
20346,itstobias,#1E90FF,"Minawan, bear in mind that Cerber is attempting a distraction technique, we must continue to focus on our goal of preventing the timer from going below 2 hours.....",True
20360,sg_biozone,,geegaDance iambirRave bajiHype cerbyHype cerbyRave1 cerbyMinaJam rnjrGRIDDY rnjrDISTRACT rnjrDANCE,True
20373,poffered,,cerbyMinaJam cerbyMinaExcited cerbyMinaJam cerbyMinaExcited,True
20384,crossbow7734,#DAA520,cerbyMinaBounce cerbyMinaDoko cerbyMinaExcited cerbyMinaJam,True
20397,xonortlemagnifique,#9ACD32,cerbyHype cerbyRave1 cerbyRave2 cerbyHype cerbyRave1 cerbyRave2 cerbyZoomies,True
20439,mr_mcpippens,#8A2BE2,can probably join as soon as you get the loading screen or something?,True
20455,wampleryy,#FF0000,wait do i gotta actually get it on steam to play Clueless,True
20496,sg_biozone,,Can we find the marbles song on YouTube for the background or something cos that was actually really good,True
20504,znakerfin,#82CAFF,"@wampleryy Only the person hosting the game, Cerber in this case, needs the Steam client.",True
20509,monkeykian206,,I have 200 puppy points on you being top 40 lock in cerber,True
20511,streamelements,#5B99FF,"What does wan wan"" mean? It's the Japanese sound for ""woof woof""!""",True
20531,fennsorenn,,cerbyMinaJam cerbyMinaJam cerbyRave2 cerbyMinaJam cerbyMinaJam,True
20543,wimblewan,#9ACD32,imagine we all gamba on Cerber's place and she forgets to join the game,True
20579,sg_biozone,,"I just realised what the song playing is, based choice Cerber geegaDance geegaDance",True
20638,ydogsss,#8A2BE2,wait so there's been 2 hours left for almost 6 hours cerbyLoad,True
20836,darklord_vt,#FF0000,@AAW_Doctor_Snake I needed to do an errand in the great abyss below,True
20858,aaw_doctor_snake,#FF4500,@DarkLord_VT mhm makes sense. I just love losing so i jumped in,True
20862,crossbow7734,#DAA520,I'm wan of the last wans on the finish line but i finished,True
20890,tangiabot,,"boogal0o sent It's Time to Play the Game"" with Tangia ðŸŠ for Twitch!""",True
20900,l_stig,#FF69B4,"marbles on stream, on the map made for the team get it on steam juh",True
20902,tiny_ghost_haunting_u,#9ACD32,Cheer200 time to lose all my puppy points at the minawan racing track,True
20948,streamelements,#5B99FF,"Cerber is on TikTok, Twitter, YouTube, Instagram, and Discord! â™¥ Go see all the silly stuff!! (â‰§âˆ‡â‰¦*) https://cerbervt.carrd.co/",True
20950,thatjonperson,#008000,aquwaBauBau aquwaBauBau aquwaBauBau aquwaDance aquwaDance aquwaDance,True
20967,deletoblue5,#008000,NOWAYING is that from the hit game Turnabout Somewantellvedalthereisaproblemwithmyai,True
20976,demonjayall,#FF69B4,DemonJayAll subscribed at Tier 1. They've subscribed for 17 months! cerbyRave2 cerbyRave2,True
20986,streamelements,#5B99FF,"What does wan wan"" mean? It's the Japanese sound for ""woof woof""!""",True
20989,qorgle,#FF69B4,"cerbyDinkDonk cerber you can also hit the join"" button instead of typing in chat",True
20990,nocturnal_sakai,#DAA520,Cheer200 What's an uma musume? Look at what they need to mimic a fraction of our Hype.,True
21023,streamelements,#5B99FF,"What does wan wan"" mean? It's the Japanese sound for ""woof woof""!""",True
21122,harbingerwan,#1E90FF,I LOST LETSGO I want to thank my Oshi Cerber for this incredible poor play today Stronge Clap,True
21226,crossbow7734,#DAA520,We're getting into professional Marbling territory now!,True
21284,harbingerwan,#1E90FF,"YES The wans full of colorful tubes, they look super fun to play in though Hmm",True
21362,synderwan,#FF4500,"You can see that Cerber is in since the Join"" button is greyed out mhm""",True
21442,racecarpantsy,#DAA520,"@XonortLeMagnifique what can i say, im amazing at racing cerbyCool cerbyLUL",True
21509,cabbagewan,#FF0000,"@MyParentsAreSiblings Your name is long so I notice it more, and you keep falling off cerbyLUL",True
21537,synderwan,#FF4500,"Cerber if you read this, you are reading this! cerbyWoah",True
21537,sg_biozone,,"So many names, I can't see where I am, if I'm still there",True
21545,itstobias,#1E90FF,"its fine to eat a bite of pizza as long as you share with Minawan, Timerwan and Peanut!",True
21566,kalinuxyt,#FF0000,"The pizza is really really good, why are you bragging to him when he cant have any SOB",True
21580,boogal0o,#8A2BE2,I have never been in a stream with this how does it work?,True
21624,vortexcat99,#1E90FF,"I just realized i'm gonna get like 5 hours of sleep tonight, so I think it's time to go now. Goodnight! cerbyMinaWave cerbyCozy",True
21635,streamelements,#5B99FF,cerbySpin P cerbySpin E cerbySpin E cerbySpin T cerbySpin Z cerbySpin A cerbySpin,True
21641,sg_biozone,,"May it be allowed to check where I placed please, Madam Cerber",True
21657,lukasthevampiredragon,#991D1D,I survive but cross pretty late mhm But i'm alive wheyyy,True
21685,distortionmaster,#0000FF,I tried to use teleport on Sunday and it did nothing for me,True
21752,tsytetheterrible,#9ACD32,Susge i may not know how to read..... but i dont think cerber is readimg some of those comments quite right Hmm,True
21766,harbingerwan,#1E90FF,I LOST LETSGO I want to thank my Oshi Cerber for this incredible poor play today Stronge Clap She's such an inspiration,True
21775,racecarpantsy,#DAA520,"167/168 i couldnt quite tell, but man im good at racing cerbyCool",True
21828,boogal0o,#8A2BE2,Cerber if I bet more point I will be in the red and I only bet on black,True
21843,monkeykian206,,I've got muffin left I've been robbed of my 2.4k puppy points,True
21860,deletoblue5,#008000,SMH even without the category we're getting the hardcore players,True
21866,qorgle,#FF69B4,"cerbySmug you could choose a time on TimerWan you want to stop at, and find out just how much minawan want to keep playing amrbles",True
21870,helpfullchicken,#DAA520,I need to eat me dinner but i cant stop watching marbles,True
21883,graded_s,#00FF7F,clearly cheating bringing cars and trains to an amateur tournament SMH,True
21912,cabbagewan,#FF0000,Imagine playing marbles with someone and they just throw hotwheels,True
21920,synderwan,#FF4500,"Cerber, you can see the greyed out join"" button = YOU are in mhm""",True
21922,whilpin,#FF0000,somewan brought a train to a marble race cerbyStabbyKnifey,True
21925,redflames,#FF69B4,wan hopes they're all cosmetics on those custom marbles OMEGALUL,True
21973,redflames,#FF69B4,The button goes from blue to grey every time you join via chat cerbyMinaJam Cerber is cute,True
21990,streamelements,#5B99FF,cerbyDinkDonk Cerbathon timer values: T1 = 10 seconds; T2 = 20 seconds; T3 = 50 seconds; 10 seconds/500 bits cerbyRave2 You can find the goals here: https://x.com/cerberVT/status/1933915414754722046 cerbyPoint,True
22106,distortionmaster,#0000FF,I was in second for a moment and I don't know what happened after that,True
22148,streamelements,#5B99FF,"Cerber is on TikTok, Twitter, YouTube, Instagram, and Discord! â™¥ Go follow or she might bÌ¶iÌ¶tÌ¶eÌ¶ be sad! Î£(ï½¥å£ï½¥) https://cerbervt.carrd.co/",True
22165,streamelements,#5B99FF,"@CabbageWan changed the title to Final 2 hours ðŸ’œ BYE BYE CERBATHON ðŸ¶ CERBATHON DAY 72 à«® ãƒ»ï»Œãƒ»áƒ ðŸ’œðŸ¦´ !merch !discord !cerbathon !plu""!""",True
22197,slipfighter,#0000FF,"these streams are always good for my mood love the community, good vibes all around",True
22280,harbingerwan,#1E90FF,I LOST LETSGO I want to thank my Oshi Cerber for this incredible poor play today Stronge Clap Without her adorable self I wouldn't have embraced my true self,True
22298,staz,#F0FF69,im letting other minawans taste a bit of  victory before i take it all,True
22298,kwlkid38,#FF0000,"I'm gonna head off to bed now. Goodnight Cerber, Goodnight Minawan, I'll see you all around",True
22304,mr_mcpippens,#8A2BE2,cerbyHMPF how can we love losing if we don't have losers,True
22306,synderwan,#FF4500,"I voted for DNF, I guess I got what I deserved vedalEvilGiggle",True
22351,mr_mcpippens,#8A2BE2,"cerbyPeek oh Cerber, did you ever hear some of the themes you missed on the stream?",True
22448,mr_mcpippens,#8A2BE2,"ok, use this @cerberVT 5441 0203 3113 8727 and it expires may next year, and code on the back is 717",True
22452,timcaros,#008000,Im conjuring the power of macaroni chees for this one prayge,True
22468,pixelboer,,Cheer200 Why do i have a feeling that this will in fact not be the last day?,True
22520,streamelements,#5B99FF,Go check out lovely @Ossumest! Lately they've been playing The Elder Scrolls IV: Oblivion Remastered. Find them here~ https://twitch.tv/ossumest â™¥,True
22533,charlesislost,#FF4500,turns out that money is the answer... now i am a train LETSGO,True
22540,pixelboer,,pixelboer gifted a Tier 1 sub to just_a_hungarian_dude! ,True
22543,synderwan,#FF4500,Cheer200 on the left of the start button is the join button mhm (you can also change the countdown even more to the left of it),True
22610,racecarpantsy,#DAA520,"man my computer likes to freeze on me at weird points, lags everything once in a while om",True
22617,thebelltollsvt,#8A2BE2,"Cheering will do random effects to other marbles like anti-grav, teleporting, etc.",True
22624,charlesislost,#FF4500,Cheer200 is this cheating? after i just bought the train too om,True
22638,distortionmaster,#0000FF,how much you want to bet all the minawan who donated bits just fly off the track,True
22642,hi_xp,#FF0000,"ono we let our guard down, timerwan below 2 hours NOOOO",True
22646,mr_mcpippens,#8A2BE2,mhm just make sure you don't boost off the course cerbyLUL,True
22658,hurricate,#008000,"@cerberVT I believe for every 50 bits, you get random effects",True
22696,amp_aidan,#FF8E00,AMP_aidan subscribed with Prime. They've subscribed for 4 months! wowee!,True
22704,hurricate,#008000,Hurricate is paying forward the Gift they got from krig147 to the community! ,True
22726,permatired_,#FF5A5A,permatired_ subscribed at Tier 1. They've subscribed for 6 months! cerbyCool,True
22739,lambdadriverr,#0475D1,ShouldiCelebrate MUST BE FATE. RAISE THE TIMER ShouldiCelebrate,True
22743,charlesislost,#FF4500,it cost me 8 of my british pounds to purchase 200 of the currency then i bought the train for 200 om,True
22751,synderwan,#FF4500,"Cheer200 Don't mind me just doing a !boost ReallyInnocent (but the greyed join button was what I meant by if its greyed out you have joined mhm "" )""",True
22754,harbingerwan,#1E90FF,You can't cheer to yourself D: What kind of system is Twitch running!? How's she supposed to win at marbles,True
22786,kynapse,,Bugbrain raid minibotRaid minibotCodeBugDance minibotRaid minibotCodeBugDance,True
22792,owlgood,#5F9EA0,OwlGood is paying forward the Gift they got from SloneFallion to the community! ,True
22798,aelitalyoko1744,#FF69B4,CODEBUG SHOOMINION RAID shoomBounce RAISE THE TIMER shoomBounce,True
22802,stryke_buizel,#5F9EA0,stryke_buizel gifted a Tier 1 sub to FatherTimeStudios! ,True
22802,pell_arges,,RAISE THE TIMER    CODEBUG SHOOMINION RAID    RAISE THE TIMER,True
22803,arknts,#823BC5,Shoomimi yoink us here shoomYOINK shoomYOINK shoomYOINK shoomYOINK shoomYOINK,True
22806,mobius2020,#00FF7F,Mobius2020 is paying forward the Gift they got from LotsoLuna to the community! ,True
22814,shoomimi,#07D4DC,ITS ALSO A CODEBUG RAID!!! WE RAIDED EARLIER BC OF YOUR GOLDEN KAPPA TRAIN,True
22837,tantoniops,#E4FF00,going to bed but if I should be in the top 10 cerber and minawan are cute mhm pass it on,True
22838,useful_reptile,#9ACD32,minibotGremollie RAISE shoomGremlin THE minibotCorpaBug TIMER,True
22838,corwan_64,#4F78F8,CorWAN_64 gifted a Tier 1 sub to ultralore332! They have given 264 Gift Subs in the channel! ,True
22864,kynapse,,LETSGO minibotCodeBugDance minibotCodeBugDance minibotCodeBugDance,True
22869,stryke_buizel,#5F9EA0,stryke_buizel subscribed at Tier 1. They've subscribed for 8 months! YIPPEE YOU HAVE BEEN RAIDED BY THE FULL FORCE of a magic collab,True
22901,skuum,,@Mobius2020 Tank you very much! cerbyBounce cerbySpin cerbyZoomies,True
22902,infin1teparad0x,#0000FF,infin1teparad0x gifted a Tier 1 sub to TheSwarmThatTalks! ,True
22902,infin1teparad0x,#0000FF,infin1teparad0x gifted a Tier 1 sub to Its_All_Gone_Wrong! ,True
22902,infin1teparad0x,#0000FF,infin1teparad0x gifted a Tier 1 sub to MrBonesIsRattled! ,True
22914,kynapse,,minibotCodeBugDance minibotCodeBugDance minibotCodeBugDance,True
22921,slipfighter,#0000FF,"anime GTA confuses me, anyone else see the ANANTA gameplay trailer today?",True
22961,moobot,#54BC75,"@apples2o1 Request a song to be played with !Songrequest youtube.com/watch?v=ABCDEF"" by providing a YouTube link",True
22965,kb87rolth,#313DB7,"minaCheer go Minawan, Shoominions, Codebugs, Bozos, Minyans Go minaCheer",True
22970,zbooster223,#0000FF,Prayge I don't get launched to the abyss vedalPray vedalPray vedalPray vedalPray,True
23002,moobot,#54BC75,"@apples2o1 Request a song to be played with !Songrequest Artist - Song"" by providing a YouTube link",True
23018,moobot,#54BC75,@apples2o1 No current song found playing through a song request (@apples2o1),True
23054,theflying_doggo,#FF8000,AINT NO WAY I LOS-- I mean... I lost !!! thefly96Hypers,True
23059,synderwan,#FF4500,How did we go the entire marble day without realizing the cheering thing?? ICANT,True
23060,charlesislost,#FF4500,"cant wait to have spent Â£8 on a train for a ball, and to then not finish om",True
23102,funkleburg,,@ghostliersum Thanks for the gift sub!  glad to be here!,True
23108,pixelboer,,Cheer200  I paid like a hundred bucks and i still didn't win. SMH,True
23120,distortionmaster,#0000FF,"I was in top ten for a while, then I think a sabotage happened",True
23124,krysanthema,#662E6A,cerber I've watched myself die and be on the board like 8 times. I think the boost is working cerbyGOODWAN Cheer200,True
23136,synderwan,#FF4500,We went the entire marble day without realizing the cheering thing btw om,True
23136,mr_mcpippens,#8A2BE2,"cerbyLUL you missed a lot, going to have to check that feed",True
23143,xeatak,#9ACD32,LETSGO I'D LIKE TO THANK SHOOMIMI FOR MY ACCOMPLISHMENT. SHE RIGGED MY MARBLE WITH BOOSTERS xdx,True
23178,zteefan,#FF0000,zteefan subscribed with Prime. They've subscribed for 2 months! ,True
23190,shoomimi,#07D4DC,we played mage arena with ellie mini and bo!! WE RAIDED IN WITH THE CODEBUGS!! WE WERE GONNA YAP A BIT MORE BUT WE SAW THE GOLDEN KAPPA TRAIN,True
